{
  "authority": {
    "plan_blob_sha": "ac158561be17aa8424a71b53d5447ae4a2d375c7",
    "plan_path": "docs/superpowers/plans/2026-09-29-k3-learner-evidence-engine.md",
    "process_failure_rules_digest": "6f30c61bd07df8d2960f6b5acf199f5188493a0a394ae7151c3330245c263760",
    "process_failure_rules_revision": "h0-r2-v1",
    "spec_blob_sha": "2ccb4c5c1d01b668c14dce6b97608d4eff04d57d",
    "spec_path": "docs/superpowers/specs/2026-09-29-k3-learner-evidence-engine-design.md",
    "task_source_digest": "1062598eb5504ecbdd65c42a96a0249eee33396eff8b6f3bbd43c8e6ee23944d"
  },
  "commit": {
    "message": "feat: add K3 attempt projection"
  },
  "dependencies": [
    20
  ],
  "green": {
    "command": "node --test tests/k3-attempt-projection.test.js",
    "expected_result": "PASS with zero failures for the exact task verification command."
  },
  "implementation": {
    "intent": "Implement current authoritative response selection only from accepted revision history.",
    "prohibited_inventions": []
  },
  "interfaces": {
    "consumes": [],
    "produces": [
      "`projectAttempt(events,{formSnapshot,throughStoreSeq,policyVersion})->AttemptProjectionV1`."
    ]
  },
  "merge_authority": false,
  "packet_version": 1,
  "phase": "D — Strict assessment authority, corrections, and projections",
  "programme": "K3",
  "purpose": "Execute approved K3 Task 21: AttemptProjectionV1",
  "red": {
    "command": "node --test tests/k3-attempt-projection.test.js",
    "expected_failure_class": "EXPECTED_TASK_BEHAVIOR_MISSING",
    "expected_failure_description": "FAIL because the task's specified behavior is not yet implemented. Module/import/path/setup failure alone does not satisfy RED; repair the test harness until the intended behavioral assertion fails.",
    "invalid_failure_classes": [
      "UNRELATED_IMPORT_FAILURE",
      "SETUP_FAILURE",
      "ENVIRONMENT_FAILURE"
    ]
  },
  "regression": {
    "command": "npm test",
    "expected_result": "PASS with zero failures"
  },
  "required_skills": [
    "test-driven-development",
    "systematic-debugging"
  ],
  "runtime_requirements": [],
  "schema_version": 1,
  "scope": {
    "allowed_create": [
      "src/evidence/projections/attemptProjection.js",
      "tests/k3-attempt-projection.test.js"
    ],
    "allowed_delete": [],
    "allowed_modify": [],
    "forbidden_paths": [],
    "product_scope": "K3_TASK_21"
  },
  "source_contract_digest": "b08184f5e2f110096e71eab9366e23d53a6982c2acde7ae8b23136d7bfdc4199",
  "stop_conditions": [
    "On any spec/plan conflict, record `Ruling:` and follow the spec. On any unexpected failure, invoke `systematic-debugging` before editing implementation. A low-reasoning executor must not merge, integrate, or push directly to `main`; stop at the high-reasoning merge gate. - [ ] Write failing tests for A->B->C answer changes, APPLIED/STALE device branches, unanswered-at-submit derivation, evaluation/regrade references, VOID/SUPERSEDE. - [ ] Execute the exact RED command from the Low-model execution contract above and confirm Expected RED. - [ ] Implement current authoritative response selection only from accepted revision history. - [ ] Run GREEN; verify underlying response history references remain. - [ ] Commit `feat: add K3 attempt projection`."
  ],
  "task_id": 21,
  "task_title": "AttemptProjectionV1"
}
