{
  "authority": {
    "plan_blob_sha": "ac158561be17aa8424a71b53d5447ae4a2d375c7",
    "plan_path": "docs/superpowers/plans/2026-09-29-k3-learner-evidence-engine.md",
    "process_failure_rules_digest": "6f30c61bd07df8d2960f6b5acf199f5188493a0a394ae7151c3330245c263760",
    "process_failure_rules_revision": "h0-r2-v1",
    "spec_blob_sha": "2ccb4c5c1d01b668c14dce6b97608d4eff04d57d",
    "spec_path": "docs/superpowers/specs/2026-09-29-k3-learner-evidence-engine-design.md",
    "task_source_digest": "e4697ebc6cd87bffac3e4992cff4ebd6840af912bdebfda6f380e8e6e2b601ad"
  },
  "commit": {
    "message": "feat: add xAPI K3 adapter"
  },
  "dependencies": [
    31
  ],
  "green": {
    "command": "node --test tests/k3-xapi-adapter.test.js",
    "expected_result": "PASS with zero failures for the exact task verification command."
  },
  "implementation": {
    "intent": "Implement only supported deterministic mappings; actor identity remains pseudonymous.",
    "prohibited_inventions": []
  },
  "interfaces": {
    "consumes": [],
    "produces": [
      "export returns xAPI statements + mapping report; import either maps with exact required K3 context, stages, or rejects. Never implement an LRS."
    ]
  },
  "merge_authority": false,
  "packet_version": 1,
  "phase": "G — Interoperability and governed bridges",
  "programme": "K3",
  "purpose": "Execute approved K3 Task 32: xAPI 2.0 adapter",
  "red": {
    "command": "node --test tests/k3-xapi-adapter.test.js",
    "expected_failure_class": "EXPECTED_TASK_BEHAVIOR_MISSING",
    "expected_failure_description": "FAIL because the task's specified behavior is not yet implemented. Module/import/path/setup failure alone does not satisfy RED; repair the test harness until the intended behavioral assertion fails.",
    "invalid_failure_classes": [
      "UNRELATED_IMPORT_FAILURE",
      "SETUP_FAILURE",
      "ENVIRONMENT_FAILURE"
    ]
  },
  "regression": {
    "command": "npm test",
    "expected_result": "PASS with zero failures"
  },
  "required_skills": [
    "test-driven-development",
    "systematic-debugging"
  ],
  "runtime_requirements": [],
  "schema_version": 1,
  "scope": {
    "allowed_create": [
      "src/platform-kernel/interoperability/xapi.js",
      "data/evidence/mappings/xapi-v1.json",
      "tests/k3-xapi-adapter.test.js"
    ],
    "allowed_delete": [],
    "allowed_modify": [],
    "forbidden_paths": [],
    "product_scope": "K3_TASK_32"
  },
  "source_contract_digest": "f73c56688af2de9c6eaf1e11e123a0c47abc54137aa21ee74e5ac13b799c1394",
  "stop_conditions": [
    "On any spec/plan conflict, record `Ruling:` and follow the spec. On any unexpected failure, invoke `systematic-debugging` before editing implementation. A low-reasoning executor must not merge, integrate, or push directly to `main`; stop at the high-reasoning merge gate. - [ ] Write failing response/evaluation/attempt/timestamp/lossiness/PII/import-abstention tests. - [ ] Execute the exact RED command from the Low-model execution contract above and confirm Expected RED. - [ ] Implement only supported deterministic mappings; actor identity remains pseudonymous. - [ ] Execute the exact GREEN command from the Low-model execution contract above and confirm Expected GREEN. - [ ] Commit `feat: add xAPI K3 adapter`."
  ],
  "task_id": 32,
  "task_title": "xAPI 2.0 adapter"
}
