{
  "authority": {
    "plan_blob_sha": "ac158561be17aa8424a71b53d5447ae4a2d375c7",
    "plan_path": "docs/superpowers/plans/2026-09-29-k3-learner-evidence-engine.md",
    "process_failure_rules_digest": "6f30c61bd07df8d2960f6b5acf199f5188493a0a394ae7151c3330245c263760",
    "process_failure_rules_revision": "h0-r2-v1",
    "spec_blob_sha": "2ccb4c5c1d01b668c14dce6b97608d4eff04d57d",
    "spec_path": "docs/superpowers/specs/2026-09-29-k3-learner-evidence-engine-design.md",
    "task_source_digest": "5f29139741ff769c1a50e5581f196e4230f0cf2d5ce9996f014ee30d10bb0fe9"
  },
  "commit": {
    "message": "test: add K3 learner evidence acceptance gate"
  },
  "dependencies": [
    35
  ],
  "green": {
    "command": "node --test tests/k3-learner-evidence-acceptance.test.js",
    "expected_result": "PASS with zero failures for the exact task verification command."
  },
  "implementation": {
    "intent": "Add failing acceptance assertions for any criterion not already pinned by focused tests.",
    "prohibited_inventions": []
  },
  "interfaces": {
    "consumes": [],
    "produces": [
      "spec §47 is covered one-for-one; protected question payload digest remains exact."
    ]
  },
  "merge_authority": false,
  "packet_version": 1,
  "phase": "H — Repository gates, acceptance, review, and integration",
  "programme": "K3",
  "purpose": "Execute approved K3 Task 36: K3 acceptance suite",
  "red": {
    "command": "node --test tests/k3-learner-evidence-acceptance.test.js",
    "expected_failure_class": "EXPECTED_TASK_BEHAVIOR_MISSING",
    "expected_failure_description": "FAIL because the task's specified behavior is not yet implemented. Module/import/path/setup failure alone does not satisfy RED; repair the test harness until the intended behavioral assertion fails.",
    "invalid_failure_classes": [
      "UNRELATED_IMPORT_FAILURE",
      "SETUP_FAILURE",
      "ENVIRONMENT_FAILURE"
    ]
  },
  "regression": {
    "command": "npm test",
    "expected_result": "PASS with zero failures"
  },
  "required_skills": [
    "test-driven-development",
    "systematic-debugging"
  ],
  "runtime_requirements": [],
  "schema_version": 1,
  "scope": {
    "allowed_create": [
      "tests/k3-learner-evidence-acceptance.test.js"
    ],
    "allowed_delete": [],
    "allowed_modify": [
      "scripts/browser_smoke.py"
    ],
    "forbidden_paths": [],
    "product_scope": "K3_TASK_36"
  },
  "source_contract_digest": "58f8ab614622b4ff8a93f7e138d5b0c56faef11aaea349d5bbc63e22d5d61aa7",
  "stop_conditions": [
    "On any spec/plan conflict, record `Ruling:` and follow the spec. On any unexpected failure, invoke `systematic-debugging` before editing implementation. A low-reasoning executor must not merge, integrate, or push directly to `main`; stop at the high-reasoning merge gate. - [ ] Add failing acceptance assertions for any criterion not already pinned by focused tests. - [ ] Run targeted RED and close gaps in the owning component, not by weakening acceptance. - [ ] Run `npm run validate && npm test && npm run verify:sw`. - [ ] Run `PYTHONPATH=server python3 -m pytest server/tests -q && python3 scripts/browser_smoke.py`. - [ ] Commit `test: add K3 learner evidence acceptance gate`."
  ],
  "task_id": 36,
  "task_title": "K3 acceptance suite"
}
