{
  "authority": {
    "plan_blob_sha": "ac158561be17aa8424a71b53d5447ae4a2d375c7",
    "plan_path": "docs/superpowers/plans/2026-09-29-k3-learner-evidence-engine.md",
    "process_failure_rules_digest": "6f30c61bd07df8d2960f6b5acf199f5188493a0a394ae7151c3330245c263760",
    "process_failure_rules_revision": "h0-r2-v1",
    "spec_blob_sha": "2ccb4c5c1d01b668c14dce6b97608d4eff04d57d",
    "spec_path": "docs/superpowers/specs/2026-09-29-k3-learner-evidence-engine-design.md",
    "task_source_digest": "2e40b79e2df0cf45c9400be43d8102c08799efe9be2caf8eaee21cb1540036d1"
  },
  "commit": {
    "message": "ci: add K3 evidence release gates"
  },
  "dependencies": [
    34
  ],
  "green": {
    "command": "node --test tests/k3-release-boundary.test.js tests/release-contract.test.js tests/service-worker-contract.test.js",
    "expected_result": "PASS with zero failures for the exact task verification command."
  },
  "implementation": {
    "intent": "Update validation/workflows/service-worker asset list.",
    "prohibited_inventions": []
  },
  "interfaces": {
    "consumes": [],
    "produces": [
      "validate K3 schemas/definitions/mappings; CI runs Node + Python + browser smoke; Pages includes only browser-required evidence modules/context and excludes private evidence/factory/admin data."
    ]
  },
  "merge_authority": false,
  "packet_version": 1,
  "phase": "H — Repository gates, acceptance, review, and integration",
  "programme": "K3",
  "purpose": "Execute approved K3 Task 35: Integrate K3 validation and public/private release boundaries",
  "red": {
    "command": "node --test tests/k3-release-boundary.test.js tests/release-contract.test.js tests/service-worker-contract.test.js",
    "expected_failure_class": "EXPECTED_TASK_BEHAVIOR_MISSING",
    "expected_failure_description": "FAIL because the task's specified behavior is not yet implemented. Module/import/path/setup failure alone does not satisfy RED; repair the test harness until the intended behavioral assertion fails.",
    "invalid_failure_classes": [
      "UNRELATED_IMPORT_FAILURE",
      "SETUP_FAILURE",
      "ENVIRONMENT_FAILURE"
    ]
  },
  "regression": {
    "command": "npm test",
    "expected_result": "PASS with zero failures"
  },
  "required_skills": [
    "test-driven-development",
    "systematic-debugging"
  ],
  "runtime_requirements": [],
  "schema_version": 1,
  "scope": {
    "allowed_create": [
      "tests/k3-release-boundary.test.js"
    ],
    "allowed_delete": [],
    "allowed_modify": [
      "scripts/validate.js",
      ".github/workflows/ci.yml",
      ".github/workflows/pages.yml",
      "scripts/verify_sw_assets.js",
      "scripts/verify_live_release.js",
      "sw.js",
      "tests/release-contract.test.js",
      "tests/service-worker-contract.test.js"
    ],
    "forbidden_paths": [],
    "product_scope": "K3_TASK_35"
  },
  "source_contract_digest": "4f554c2beeec389cda52177bb9b2410d5c6d902fc796f0ab1b57c2b98ff1aa34",
  "stop_conditions": [
    "On any spec/plan conflict, record `Ruling:` and follow the spec. On any unexpected failure, invoke `systematic-debugging` before editing implementation. A low-reasoning executor must not merge, integrate, or push directly to `main`; stop at the high-reasoning merge gate. - [ ] Write failing artifact-boundary and CI-contract tests. - [ ] Execute the exact RED command from the Low-model execution contract above and confirm Expected RED. - [ ] Update validation/workflows/service-worker asset list. - [ ] Run GREEN and assemble/verify the Pages artifact locally. - [ ] Commit `ci: add K3 evidence release gates`."
  ],
  "task_id": 35,
  "task_title": "Integrate K3 validation and public/private release boundaries"
}
