{
  "authority": {
    "plan_blob_sha": "ac158561be17aa8424a71b53d5447ae4a2d375c7",
    "plan_path": "docs/superpowers/plans/2026-09-29-k3-learner-evidence-engine.md",
    "process_failure_rules_digest": "6f30c61bd07df8d2960f6b5acf199f5188493a0a394ae7151c3330245c263760",
    "process_failure_rules_revision": "h0-r2-v1",
    "spec_blob_sha": "2ccb4c5c1d01b668c14dce6b97608d4eff04d57d",
    "spec_path": "docs/superpowers/specs/2026-09-29-k3-learner-evidence-engine-design.md",
    "task_source_digest": "c4a2444eb0623b384e91ff51845894747b1d1e92e5b9349bcf8c96a89e7a6943"
  },
  "commit": {
    "message": "feat: add K3 browser evidence recorder"
  },
  "dependencies": [
    27
  ],
  "green": {
    "command": "node --test tests/k3-evidence-recorder.test.js",
    "expected_result": "PASS with zero failures for the exact task verification command."
  },
  "implementation": {
    "intent": "Implement recorder entirely over already-tested local capture/store primitives.",
    "prohibited_inventions": []
  },
  "interfaces": {
    "consumes": [],
    "produces": [
      "`createEvidenceRecorder({store,outbox,runtimeContext,clock,crypto})`; methods `startActivity`, `presentItem`, `recordResponse`, `recordConfidence`, `requestHint`, `openExplanation`, `submitAssessment`, `recordEvaluation`."
    ]
  },
  "merge_authority": false,
  "packet_version": 1,
  "phase": "F — Browser runtime integration without learner-visible behavior change",
  "programme": "K3",
  "purpose": "Execute approved K3 Task 28: Browser EvidenceRuntime manager",
  "red": {
    "command": "node --test tests/k3-evidence-recorder.test.js",
    "expected_failure_class": "EXPECTED_TASK_BEHAVIOR_MISSING",
    "expected_failure_description": "FAIL because the task's specified behavior is not yet implemented. Module/import/path/setup failure alone does not satisfy RED; repair the test harness until the intended behavioral assertion fails.",
    "invalid_failure_classes": [
      "UNRELATED_IMPORT_FAILURE",
      "SETUP_FAILURE",
      "ENVIRONMENT_FAILURE"
    ]
  },
  "regression": {
    "command": "npm test",
    "expected_result": "PASS with zero failures"
  },
  "required_skills": [
    "test-driven-development",
    "systematic-debugging"
  ],
  "runtime_requirements": [],
  "schema_version": 1,
  "scope": {
    "allowed_create": [
      "src/evidence/recorder.js",
      "tests/k3-evidence-recorder.test.js"
    ],
    "allowed_delete": [],
    "allowed_modify": [
      "src/storage/interface.js",
      "src/storage/browser.js",
      "src/evidence/indexedDbStore.js"
    ],
    "forbidden_paths": [],
    "product_scope": "K3_TASK_28"
  },
  "source_contract_digest": "16000b8afa4cf9424c24787950d7f467c4a2c361858daae5dbbd91dcaf1e47af",
  "stop_conditions": [
    "On any spec/plan conflict, record `Ruling:` and follow the spec. On any unexpected failure, invoke `systematic-debugging` before editing implementation. A low-reasoning executor must not merge, integrate, or push directly to `main`; stop at the high-reasoning merge gate. - [ ] Write failing ordered-event tests. - [ ] Execute the exact RED command from the Low-model execution contract above and confirm Expected RED. - [ ] Implement recorder entirely over already-tested local capture/store primitives. - [ ] Execute the exact GREEN command from the Low-model execution contract above and confirm Expected GREEN. - [ ] Commit `feat: add K3 browser evidence recorder`."
  ],
  "task_id": 28,
  "task_title": "Browser EvidenceRuntime manager"
}
