{
  "authority": {
    "plan_blob_sha": "ac158561be17aa8424a71b53d5447ae4a2d375c7",
    "plan_path": "docs/superpowers/plans/2026-09-29-k3-learner-evidence-engine.md",
    "process_failure_rules_digest": "6f30c61bd07df8d2960f6b5acf199f5188493a0a394ae7151c3330245c263760",
    "process_failure_rules_revision": "h0-r2-v1",
    "spec_blob_sha": "2ccb4c5c1d01b668c14dce6b97608d4eff04d57d",
    "spec_path": "docs/superpowers/specs/2026-09-29-k3-learner-evidence-engine-design.md",
    "task_source_digest": "ca103f672f41c5f4952a9d502b9a297f67cc5234c78dffce37e8027306f31ee9"
  },
  "commit": {
    "message": "feat: add K3 correction resolution"
  },
  "dependencies": [
    18
  ],
  "green": {
    "command": "node --test tests/k3-evidence-corrections.test.js",
    "expected_result": "PASS with zero failures for the exact task verification command."
  },
  "implementation": {
    "intent": "Implement deterministic correction resolution without mutating target bytes.",
    "prohibited_inventions": []
  },
  "interfaces": {
    "consumes": [],
    "produces": [
      "`resolveCurrentEvidence(events)->{activeEvents,unresolved,conflicts}`."
    ]
  },
  "merge_authority": false,
  "packet_version": 1,
  "phase": "D — Strict assessment authority, corrections, and projections",
  "programme": "K3",
  "purpose": "Execute approved K3 Task 19: Correction/supersession graph resolver",
  "red": {
    "command": "node --test tests/k3-evidence-corrections.test.js",
    "expected_failure_class": "EXPECTED_TASK_BEHAVIOR_MISSING",
    "expected_failure_description": "FAIL because the task's specified behavior is not yet implemented. Module/import/path/setup failure alone does not satisfy RED; repair the test harness until the intended behavioral assertion fails.",
    "invalid_failure_classes": [
      "UNRELATED_IMPORT_FAILURE",
      "SETUP_FAILURE",
      "ENVIRONMENT_FAILURE"
    ]
  },
  "regression": {
    "command": "npm test",
    "expected_result": "PASS with zero failures"
  },
  "required_skills": [
    "test-driven-development",
    "systematic-debugging"
  ],
  "runtime_requirements": [],
  "schema_version": 1,
  "scope": {
    "allowed_create": [
      "src/evidence/corrections.js",
      "tests/k3-evidence-corrections.test.js"
    ],
    "allowed_delete": [],
    "allowed_modify": [],
    "forbidden_paths": [],
    "product_scope": "K3_TASK_19"
  },
  "source_contract_digest": "628836118cdf480b488826307733ec94b813f50a089b8dec061837804be99851",
  "stop_conditions": [
    "On any spec/plan conflict, record `Ruling:` and follow the spec. On any unexpected failure, invoke `systematic-debugging` before editing implementation. A low-reasoning executor must not merge, integrate, or push directly to `main`; stop at the high-reasoning merge gate. - [ ] Write failing tests for VOID, SUPERSEDE, correction-before-target, competing supersession, cycles, unauthorized authority. - [ ] Execute the exact RED command from the Low-model execution contract above and confirm Expected RED. - [ ] Implement deterministic correction resolution without mutating target bytes. - [ ] Execute the exact GREEN command from the Low-model execution contract above and confirm Expected GREEN. - [ ] Commit `feat: add K3 correction resolution`."
  ],
  "task_id": 19,
  "task_title": "Correction/supersession graph resolver"
}
