{
  "authority": {
    "plan_blob_sha": "ac158561be17aa8424a71b53d5447ae4a2d375c7",
    "plan_path": "docs/superpowers/plans/2026-09-29-k3-learner-evidence-engine.md",
    "process_failure_rules_digest": "6f30c61bd07df8d2960f6b5acf199f5188493a0a394ae7151c3330245c263760",
    "process_failure_rules_revision": "h0-r2-v1",
    "spec_blob_sha": "2ccb4c5c1d01b668c14dce6b97608d4eff04d57d",
    "spec_path": "docs/superpowers/specs/2026-09-29-k3-learner-evidence-engine-design.md",
    "task_source_digest": "d7603245fe37f2676e6e3668c0cda4f000e79336314ea207e619d61f159f5355"
  },
  "commit": {
    "message": "feat: preserve StateV2 through K3 transition"
  },
  "dependencies": [
    25
  ],
  "green": {
    "command": "node --test tests/k3-state-transition.test.js tests/state-migration.test.js",
    "expected_result": "PASS with zero failures for the exact task verification command."
  },
  "implementation": {
    "intent": "Implement only the minimal marker/transition needed; do not synthesize item-presented/response timestamps.",
    "prohibited_inventions": []
  },
  "interfaces": {
    "consumes": [],
    "produces": [
      "pre-K3 active StateV2 attempt remains resumable without invented K3 history; only activities started after K3 activation enter the new evidence stream."
    ]
  },
  "merge_authority": false,
  "packet_version": 1,
  "phase": "E — Identity, privacy lifecycle, legacy compatibility",
  "programme": "K3",
  "purpose": "Execute approved K3 Task 26: StateV2 transition compatibility",
  "red": {
    "command": "node --test tests/k3-state-transition.test.js tests/state-migration.test.js",
    "expected_failure_class": "EXPECTED_TASK_BEHAVIOR_MISSING",
    "expected_failure_description": "FAIL because the task's specified behavior is not yet implemented. Module/import/path/setup failure alone does not satisfy RED; repair the test harness until the intended behavioral assertion fails.",
    "invalid_failure_classes": [
      "UNRELATED_IMPORT_FAILURE",
      "SETUP_FAILURE",
      "ENVIRONMENT_FAILURE"
    ]
  },
  "regression": {
    "command": "npm test",
    "expected_result": "PASS with zero failures"
  },
  "required_skills": [
    "test-driven-development",
    "systematic-debugging"
  ],
  "runtime_requirements": [],
  "schema_version": 1,
  "scope": {
    "allowed_create": [
      "tests/k3-state-transition.test.js",
      "tests/state-migration.test.js"
    ],
    "allowed_delete": [],
    "allowed_modify": [
      "src/state/migrate.js"
    ],
    "forbidden_paths": [],
    "product_scope": "K3_TASK_26"
  },
  "source_contract_digest": "41b2353d073151e0ede0a0eff49c188357ab8d6da5ca8aaa80c86ea27a04a018",
  "stop_conditions": [
    "On any spec/plan conflict, record `Ruling:` and follow the spec. On any unexpected failure, invoke `systematic-debugging` before editing implementation. A low-reasoning executor must not merge, integrate, or push directly to `main`; stop at the high-reasoning merge gate. - [ ] Write failing fixtures for pre-K3 active exam and legacy exam_history. - [ ] Execute the exact RED command from the Low-model execution contract above and confirm Expected RED. - [ ] Implement only the minimal marker/transition needed; do not synthesize item-presented/response timestamps. - [ ] Run GREEN plus existing state migration tests. - [ ] Commit `feat: preserve StateV2 through K3 transition`."
  ],
  "task_id": 26,
  "task_title": "StateV2 transition compatibility"
}
