{
  "authority": {
    "plan_blob_sha": "ac158561be17aa8424a71b53d5447ae4a2d375c7",
    "plan_path": "docs/superpowers/plans/2026-09-29-k3-learner-evidence-engine.md",
    "process_failure_rules_digest": "6f30c61bd07df8d2960f6b5acf199f5188493a0a394ae7151c3330245c263760",
    "process_failure_rules_revision": "h0-r2-v1",
    "spec_blob_sha": "2ccb4c5c1d01b668c14dce6b97608d4eff04d57d",
    "spec_path": "docs/superpowers/specs/2026-09-29-k3-learner-evidence-engine-design.md",
    "task_source_digest": "8edaf83540910cf6b187d210636b88e422b91aab4d19a6286cb8a0ca587fc410"
  },
  "commit": {
    "message": "test: define K3 evidence store conformance contract"
  },
  "dependencies": [
    6
  ],
  "green": {
    "command": "node --test tests/helpers/k3StoreConformance.js tests/k3-store-port.test.js",
    "expected_result": "PASS with zero failures for the exact task verification command."
  },
  "implementation": {
    "intent": "Implement assertion + reusable conformance harness.",
    "prohibited_inventions": []
  },
  "interfaces": {
    "consumes": [],
    "produces": [
      "`EvidenceStore` requires `accept`, `acceptBatch`, `getById`, `read`; every accept path returns `EvidenceStorageReceiptV1`, and every batch path returns `EvidenceBatchResultV1`."
    ]
  },
  "merge_authority": false,
  "packet_version": 1,
  "phase": "B — Fingerprint and durable reference stores",
  "programme": "K3",
  "purpose": "Execute approved K3 Task 7: EvidenceStore port/conformance harness",
  "red": {
    "command": "node --test tests/helpers/k3StoreConformance.js tests/k3-store-port.test.js",
    "expected_failure_class": "EXPECTED_TASK_BEHAVIOR_MISSING",
    "expected_failure_description": "FAIL because the task's specified behavior is not yet implemented. Module/import/path/setup failure alone does not satisfy RED; repair the test harness until the intended behavioral assertion fails.",
    "invalid_failure_classes": [
      "UNRELATED_IMPORT_FAILURE",
      "SETUP_FAILURE",
      "ENVIRONMENT_FAILURE"
    ]
  },
  "regression": {
    "command": "npm test",
    "expected_result": "PASS with zero failures"
  },
  "required_skills": [
    "test-driven-development",
    "systematic-debugging"
  ],
  "runtime_requirements": [],
  "schema_version": 1,
  "scope": {
    "allowed_create": [
      "src/evidence/storePort.js",
      "tests/fixtures/k3/store-conformance.json",
      "tests/helpers/k3StoreConformance.js",
      "tests/k3-store-port.test.js"
    ],
    "allowed_delete": [],
    "allowed_modify": [],
    "forbidden_paths": [],
    "product_scope": "K3_TASK_7"
  },
  "source_contract_digest": "3ba7102a80a8eab66282c3c540315db0aa93d38eb967e11d3756ee63da8b5b0c",
  "stop_conditions": [
    "On any spec/plan conflict, record `Ruling:` and follow the spec. On any unexpected failure, invoke `systematic-debugging` before editing implementation. A low-reasoning executor must not merge, integrate, or push directly to `main`; stop at the high-reasoning merge gate. - [ ] Write failing port/receipt-shape tests. - [ ] Execute the exact RED command from the Low-model execution contract above and confirm Expected RED. - [ ] Implement assertion + reusable conformance harness. - [ ] Execute the exact GREEN command from the Low-model execution contract above and confirm Expected GREEN. - [ ] Commit `test: define K3 evidence store conformance contract`."
  ],
  "task_id": 7,
  "task_title": "EvidenceStore port/conformance harness"
}
