{
  "authority": {
    "plan_blob_sha": "ac158561be17aa8424a71b53d5447ae4a2d375c7",
    "plan_path": "docs/superpowers/plans/2026-09-29-k3-learner-evidence-engine.md",
    "process_failure_rules_digest": "6f30c61bd07df8d2960f6b5acf199f5188493a0a394ae7151c3330245c263760",
    "process_failure_rules_revision": "h0-r2-v1",
    "spec_blob_sha": "2ccb4c5c1d01b668c14dce6b97608d4eff04d57d",
    "spec_path": "docs/superpowers/specs/2026-09-29-k3-learner-evidence-engine-design.md",
    "task_source_digest": "814566d7610975ee1141e3931e327d7113ae213c1856a652e221f7cbe304604b"
  },
  "commit": {
    "message": "feat: add K3 learner identity links"
  },
  "dependencies": [
    22
  ],
  "green": {
    "command": "node --test tests/k3-identity-links.test.js && PYTHONPATH=server python3 -m pytest -q server/tests/test_k3_identity_links.py",
    "expected_result": "PASS with zero failures for the exact task verification command."
  },
  "implementation": {
    "intent": "Implement JS/file/SQLite parity without rewriting raw event learner IDs.",
    "prohibited_inventions": []
  },
  "interfaces": {
    "consumes": [],
    "produces": [
      "`resolveLearnerPrincipal(learnerId,records)->{principal,chain,status}`; LINK/UNLINK are append-only."
    ]
  },
  "merge_authority": false,
  "packet_version": 1,
  "phase": "E — Identity, privacy lifecycle, legacy compatibility",
  "programme": "K3",
  "purpose": "Execute approved K3 Task 23: Append-only LearnerIdentityLinkRecordV1",
  "red": {
    "command": "node --test tests/k3-identity-links.test.js && PYTHONPATH=server python3 -m pytest -q server/tests/test_k3_identity_links.py",
    "expected_failure_class": "EXPECTED_TASK_BEHAVIOR_MISSING",
    "expected_failure_description": "FAIL because the task's specified behavior is not yet implemented. Module/import/path/setup failure alone does not satisfy RED; repair the test harness until the intended behavioral assertion fails.",
    "invalid_failure_classes": [
      "UNRELATED_IMPORT_FAILURE",
      "SETUP_FAILURE",
      "ENVIRONMENT_FAILURE"
    ]
  },
  "regression": {
    "command": "npm test && PYTHONPATH=server python3 -m pytest -q server/tests",
    "expected_result": "PASS with zero failures"
  },
  "required_skills": [
    "test-driven-development",
    "systematic-debugging"
  ],
  "runtime_requirements": [],
  "schema_version": 1,
  "scope": {
    "allowed_create": [
      "src/platform-kernel/evidence/identityLinks.js",
      "scripts/platform-kernel/adapters/jsonlIdentityLinkStore.js",
      "tests/k3-identity-links.test.js",
      "server/tests/test_k3_identity_links.py"
    ],
    "allowed_delete": [],
    "allowed_modify": [
      "db/schema.sql",
      "server/app/evidence_store.py"
    ],
    "forbidden_paths": [],
    "product_scope": "K3_TASK_23"
  },
  "source_contract_digest": "bbbcd809238cb44eed52f17632af2cedde75252eb583ed18c27fe084efefed06",
  "stop_conditions": [
    "On any spec/plan conflict, record `Ruling:` and follow the spec. On any unexpected failure, invoke `systematic-debugging` before editing implementation. A low-reasoning executor must not merge, integrate, or push directly to `main`; stop at the high-reasoning merge gate. - [ ] Write failing LINK, UNLINK, chain, cycle, and conflicting-link tests. - [ ] Execute the exact RED command from the Low-model execution contract above and confirm Expected RED. - [ ] Implement JS/file/SQLite parity without rewriting raw event learner IDs. - [ ] Execute the exact GREEN command from the Low-model execution contract above and confirm Expected GREEN. - [ ] Commit `feat: add K3 learner identity links`."
  ],
  "task_id": 23,
  "task_title": "Append-only LearnerIdentityLinkRecordV1"
}
