{
  "authority": {
    "plan_blob_sha": "ac158561be17aa8424a71b53d5447ae4a2d375c7",
    "plan_path": "docs/superpowers/plans/2026-09-29-k3-learner-evidence-engine.md",
    "process_failure_rules_digest": "6f30c61bd07df8d2960f6b5acf199f5188493a0a394ae7151c3330245c263760",
    "process_failure_rules_revision": "h0-r2-v1",
    "spec_blob_sha": "2ccb4c5c1d01b668c14dce6b97608d4eff04d57d",
    "spec_path": "docs/superpowers/specs/2026-09-29-k3-learner-evidence-engine-design.md",
    "task_source_digest": "97724c86f2c41efd28032ab67de50d4a7af3f67a17de8ff782d801ffe77dca81"
  },
  "commit": {
    "message": "feat: add schema-derived K3 browser validation"
  },
  "dependencies": [
    4
  ],
  "green": {
    "command": "node --test tests/k3-generated-validators.test.js tests/k3-evidence-contract-runtime.test.js",
    "expected_result": "PASS with zero failures for the exact task verification command."
  },
  "implementation": {
    "intent": "Generate browser validators from the canonical schemas, route payload validation by `payload_schema_ref`, and implement the event constructor around generated validators; do not duplicate payload rules manually.",
    "prohibited_inventions": []
  },
  "interfaces": {
    "consumes": [],
    "produces": [
      "`npm run generate:k3-validators` compiles the approved K3 JSON Schemas with Ajv standalone into a browser-safe ES module; `newUuid()`; `createLearnerEvidenceEvent(input,runtimeContext)`; `validateLearnerEvidenceEvent(event,runtimeContext)`."
    ]
  },
  "merge_authority": false,
  "packet_version": 1,
  "phase": "A — Contracts and public evidence context",
  "programme": "K3",
  "purpose": "Execute approved K3 Task 5: Schema-derived browser validators and event constructor",
  "red": {
    "command": "node --test tests/k3-generated-validators.test.js tests/k3-evidence-contract-runtime.test.js",
    "expected_failure_class": "EXPECTED_TASK_BEHAVIOR_MISSING",
    "expected_failure_description": "FAIL because the task's specified behavior is not yet implemented. Module/import/path/setup failure alone does not satisfy RED; repair the test harness until the intended behavioral assertion fails.",
    "invalid_failure_classes": [
      "UNRELATED_IMPORT_FAILURE",
      "SETUP_FAILURE",
      "ENVIRONMENT_FAILURE"
    ]
  },
  "regression": {
    "command": "npm test",
    "expected_result": "PASS with zero failures"
  },
  "required_skills": [
    "test-driven-development",
    "systematic-debugging"
  ],
  "runtime_requirements": [],
  "schema_version": 1,
  "scope": {
    "allowed_create": [
      "scripts/generate_k3_validators.js",
      "src/evidence/generatedValidators.js",
      "src/evidence/ids.js",
      "src/evidence/contract.js",
      "tests/k3-generated-validators.test.js",
      "tests/k3-evidence-contract-runtime.test.js"
    ],
    "allowed_delete": [],
    "allowed_modify": [
      "package.json"
    ],
    "forbidden_paths": [],
    "product_scope": "K3_TASK_5"
  },
  "source_contract_digest": "858fd9d9b59b97c3971c1620c9735daeef77430e54391501562c7c9b0c4e13c6",
  "stop_conditions": [
    "On any spec/plan conflict, record `Ruling:` and follow the spec. On any unexpected failure, invoke `systematic-debugging` before editing implementation. A low-reasoning executor must not merge, integrate, or push directly to `main`; stop at the high-reasoning merge gate. - [ ] Write failing tests for generator determinism/freshness plus UUIDv4, track locale validation, required context, authority, forbidden PII/derived fields, and UTC normalization. - [ ] Run RED: `node --test tests/k3-generated-validators.test.js tests/k3-evidence-contract-runtime.test.js`. - [ ] Generate browser validators from the canonical schemas, route payload validation by `payload_schema_ref`, and implement the event constructor around generated validators; do not duplicate payload rules manually. - [ ] Run GREEN, regenerate once more and assert zero diff, then run Tasks 1/3 tests. - [ ] Commit `feat: add schema-derived K3 browser validation`."
  ],
  "task_id": 5,
  "task_title": "Schema-derived browser validators and event constructor"
}
