{
  "authority": {
    "plan_blob_sha": "ac158561be17aa8424a71b53d5447ae4a2d375c7",
    "plan_path": "docs/superpowers/plans/2026-09-29-k3-learner-evidence-engine.md",
    "process_failure_rules_digest": "6f30c61bd07df8d2960f6b5acf199f5188493a0a394ae7151c3330245c263760",
    "process_failure_rules_revision": "h0-r2-v1",
    "spec_blob_sha": "2ccb4c5c1d01b668c14dce6b97608d4eff04d57d",
    "spec_path": "docs/superpowers/specs/2026-09-29-k3-learner-evidence-engine-design.md",
    "task_source_digest": "1f2a04f226eed7585ba7f4e3495ace73a32067dbbc2244d06f17cfad86fb3436"
  },
  "commit": {
    "message": "feat: harden learning event exchange port"
  },
  "dependencies": [
    30
  ],
  "green": {
    "command": "node --test tests/interoperability-ports.test.js tests/k3-learning-event-exchange.test.js",
    "expected_result": "PASS with zero failures for the exact task verification command."
  },
  "implementation": {
    "intent": "Extend assertion/helper contract compatibly.",
    "prohibited_inventions": []
  },
  "interfaces": {
    "consumes": [],
    "produces": [
      "preserve `exportEvents`/`importEvents`; result contract reports mapping version, mapped IDs, omissions/rejections, and provenance."
    ]
  },
  "merge_authority": false,
  "packet_version": 1,
  "phase": "G — Interoperability and governed bridges",
  "programme": "K3",
  "purpose": "Execute approved K3 Task 31: Harden LearningEventExchangePort",
  "red": {
    "command": "node --test tests/interoperability-ports.test.js tests/k3-learning-event-exchange.test.js",
    "expected_failure_class": "EXPECTED_TASK_BEHAVIOR_MISSING",
    "expected_failure_description": "FAIL because the task's specified behavior is not yet implemented. Module/import/path/setup failure alone does not satisfy RED; repair the test harness until the intended behavioral assertion fails.",
    "invalid_failure_classes": [
      "UNRELATED_IMPORT_FAILURE",
      "SETUP_FAILURE",
      "ENVIRONMENT_FAILURE"
    ]
  },
  "regression": {
    "command": "npm test",
    "expected_result": "PASS with zero failures"
  },
  "required_skills": [
    "test-driven-development",
    "systematic-debugging"
  ],
  "runtime_requirements": [],
  "schema_version": 1,
  "scope": {
    "allowed_create": [
      "tests/k3-learning-event-exchange.test.js"
    ],
    "allowed_delete": [],
    "allowed_modify": [
      "src/platform-kernel/interoperability/ports.js",
      "tests/interoperability-ports.test.js"
    ],
    "forbidden_paths": [],
    "product_scope": "K3_TASK_31"
  },
  "source_contract_digest": "3496e7c41eae2eb2fe50345bfbf6eacdd2afc25130b950b97d60548c3de5b215",
  "stop_conditions": [
    "On any spec/plan conflict, record `Ruling:` and follow the spec. On any unexpected failure, invoke `systematic-debugging` before editing implementation. A low-reasoning executor must not merge, integrate, or push directly to `main`; stop at the high-reasoning merge gate. - [ ] Write failing result-contract tests while preserving existing port adapters. - [ ] Execute the exact RED command from the Low-model execution contract above and confirm Expected RED. - [ ] Extend assertion/helper contract compatibly. - [ ] Execute the exact GREEN command from the Low-model execution contract above and confirm Expected GREEN. - [ ] Commit `feat: harden learning event exchange port`."
  ],
  "task_id": 31,
  "task_title": "Harden LearningEventExchangePort"
}
